rducound_number,question_category,question_difficulty,question_text,user_answer,correct_answer,correct,unscaled_points_earned
1,9,medium,What is the last letter of the Greek alphabet?,A,Omega,True,20
2,9,medium,Which logical fallacy means to attack the character of your opponent rather than their arguments?,A,Ad hominem,True,20
3,9,hard,Who founded the Khan Academy?,B,Sal Khan,False,-15
4,9,easy,Which one of these is not a typical European sword design?,B,Scimitar,True,10
,,,,,,Total Game Score (Unscaled):,35
,,,,,,Total Game Score (Scaled):,35
